item_id,text,datalike_count
3890002120604080076_69948127729,垃圾藍白網軍開始洗全世界都有老鼠了，對啊既然然此台北市買那麼多老鼠藥幹嘛呢？ 快收一收啊,36
3890041938984979682_63045486789,既然沒有鼠患的話，國民黨台北市政府買11公噸的老鼠藥，是不是想貪污？,113
3875035979099237204_63384281815,大家還有👀到老鼠嗎,4206
3887901925485152241_65059660787,台北市買了一萬多公斤的老鼠藥。\n\n要這樣挑釁老鼠嗎？\n\n這跟買武器防中共有什麼不一樣？\n\n要跟老鼠和談簽和平共處協議，不要一直挑釁老鼠。,8432
3710543732455445913_63304928663,在路邊巧遇一隻胖老鼠卡住了⋯\n\n拯救了牠一命🐭,14568
3885332476567219442_63294282658,看到讓人震驚的日本新聞⋯⋯\n不管哪個國家哪個行業都有老鼠屎存在啊⋯\n內容實在太噁心🤮、太令人髮指了\n報導看了感覺超不舒服，大家自己斟酌一下,8045
3729329281437352225_71685374900,大福上學vlog💖\n自從帶老鼠上學被發現後 \n既然大家原來都不怕 \n那我就光明正大了🐭,83143
3889579660926310108_63438857242,我前天跟我姊打賭兩餐漢堡王（家人之間小賭怡情（？），\n起因是我跟我姊說五天內一定會有藍白黨的北七出來說老鼠/鼠患是綠營側翼之類的言論，\n然後姊說不可能，她說她不相信有人可以沒有底線到這種程度，\n我：「所以你覺得他們的無恥已經見底了？」\n我姐：「網軍不好說，但是那些人再怎麼樣也……」\n我：「我相信他們的低能還可以再突破到下水道，畢竟老鼠們都住那。」\n-\n然後今天，多謝王奶奶的造鼠說，\n果然心在下水道的人就是不會讓我失望，\n賺到兩餐wwwwww,4309
3889436152931797303_63088662770,昨天到臺北玫瑰園，看到老鼠。,587
3884586593076264206_73183866377,老實說比起市長選舉\n我更好奇台北市民能忍受老鼠到什麼程度😆,1051
3887505642106345813_64368597731,不懂就問\n為什麼要放老鼠藥挑釁老鼠啊\n人鼠一家親，不能先坐下來好好談嗎😀🤝🐭,4853
3889065671947143128_63473876061,是時候教老鼠傳教了,4792
3889640612250176733_67525438783,台北市有沒有鼠患我不知道，但一直有老鼠是真的，因為我的資深粉絲都知道，我的老家2025年初就被老鼠入侵，我前前後後抓了3隻，後來才發現是家人不小心把天窗打開10cm不自知…..\n我只能告訴大家老鼠比大家想的聰明，也比一堆網軍聰明多了，那些蠢到不行的影片，比如垃圾桶內好幾隻的影片就看看就好。老鼠很聰明的，而且非常狡猾。,841
3886639205074413223_63384281815,注意！雙連站線形公園投放老鼠藥\n\n台北市現在真的有夠鼠勾以 🐭 昨天大白天，脆友發現雙連站附近又鼠輩橫行。今天蔣萬安市府在公園附近投藥，但這樣投藥反而讓大家更擔心！\n\n三天連假要來了，雙連到中山的線形公園現在是台北市最熱鬧的地方，大家都會帶小朋友、寵物來這邊逛街散步，萬一小朋友和寵物誤觸、誤食怎麼辦！！\n\n台北滿街老鼠，蔣萬安的解決方法難道只有滿地老鼠藥嗎？,4729
3791634501257510559_65324045075,美國的新聞上還能看到老鼠在紐約地鐵裡搶麵包,52440
3888879899806031263_64228383647,今天在大安森林公園散步時，一直在想「老鼠藥」這件事⋯⋯\n\n投毒，應該是最後手段，\n除非能馬上把中毒的老鼠屍體集中處理，\n要不然，￼面對城市鼠患，我們其實可以有更科學、更有效、也更負責任的解法。\n⸻\n\n一、從源頭治理：垃圾與基礎設施才是關鍵（治本）\n\n（1）食物來源管理\n城市鼠患的核心，不是老鼠太多，而是「食物太容易取得」，\n推動垃圾不落地與全面密封化，要求商業與住宅區使用密閉式垃圾桶，不要讓街道成為老鼠的「深夜自助餐」。\n\n（2）下水道與管線整修\n定期清疏下水道、修補破損管線，並在排水口設置防鼠閘門，\n切斷老鼠在城市地下的「高速移動路網」。\n\n⸻\n\n二、科技導入：用數據取代盲目投藥（現代化治理）\n\n現代城市治理，不應再依賴大範圍投毒，而是精準出擊：\n\n（1）AI＋熱感應監測\n參考香港經驗，透過熱能攝影與 AI 分析老鼠活動路徑與時間，進行精準防治。\n\n（2）智慧監控系統（IoT）\n在鼠患熱點布建感測器，即時掌握密度變化，提前預警、提前處理。\n⸻\n（圖文相符）,82
3886766452397140033_63401453649,老鼠每個城市都有沒錯\n\n但夜行性的牠們在白天成群出沒就是異常的徵兆,3687
3890062862899635432_64420556960,看到陳水扁分享市長時，如何解決老鼠問題，就是「召集12區的環保清潔人員，集中人力起來一區一區的大掃除，將水溝、防火巷、小巷、公園清理乾淨，每天清除的垃圾立即由環保局垃圾車清運完畢，每區一個禮拜，12區花了12個禮拜。」\n\n沒什麼特別的方法，就是最基本的清掃工作。\n\n可悲的是，已經2026年了，竟還不如一位1994-1998年的市長。,1081
3890135399595053291_65832253648,拍攝日期：04/03\n這幾天看到老鼠打架、老鼠啃豬肉、老鼠游泳⋯\n讓我想到這個一個月前不小心拍到的老鼠爬電纜⋯\n\n老鼠這麼會爬，真的是要注意食物收好！！！\nBTW，還看到有人提醒，\n瓦斯線最近也要頻繁檢查喔！！！,18
3889625520882655698_31040168574,抓老鼠抓老鼠我會抓老鼠～老鼠早就很多了（這是去年），只是現在特別囂張，榮星花園和大安森林公園，我媽早就都不帶我去了，我別的朋友在那抓到的超大尾～\n\n🤓關於老鼠我媽有小小研究過，老鼠不喜歡薄荷油的味道，所以居家環境可以多噴些純薄荷精油臭牠讓牠自己滾，以前她會噴在櫃位上，基本上信義區的百貨打烊後，後場就是老鼠們的三天三夜，眉飛色舞，老鼠吃的飽睡的好，哪隻會去吃鼠藥 😒😒😒，請市長不要便宜行事\n\n👉🏻影片內的老鼠為什麼不跑呢？是因為老鼠已經被我咬了好幾口，甩暈鼠急上樹跑不掉了，然後為什麼我媽在拍是因為她不敢過來⋯⋯怕🙀～～～～\n\n👉🏻後續當然被打屁屁抓去給醫生杯杯看，並徹底洗嘴巴刷牙，現在已經戴上鈴鐺，什麼也抓不到了😓\n\n❤️我好可愛我是快樂的小獵犬\n\n#羊桃#獵犬的正常發揮,28
3889539998245060973_63494169463,現在看到台北一堆老鼠\n就想到我家紗窗被老鼠咬破還入侵我房間\n而且老鼠超愛吃巧克力 把我的零食全部吃光^_^\n害我到現在都不敢放巧克力足球在房間,1591
3888780468150180887_63245667169,昨天看到很多人說台北根本沒老鼠\n今天在Y28又遇到一隻 媽的有夠可愛,1129
3886769416125388831_70860503100,台北市的餐飲業者與攤商們\n\n很抱歉，為了生命與健康\n\n真的必需公開說、在滿街老鼠的狀況改善之前，無法在台北市外食了,33458
3890172148057328153_64214556194,傾聽在地人的聲音： \n「大家好，我是老鼠，我在信義區出生，這次台北市長選舉我堅定支持蔣萬安！」\n\n信義區-國父紀念館,2
