item_id,text,datalike_count
3889406289068086055_63303666380,林亮君議員即時澄清市府抹黑\n\n林亮君：老鼠是真的，投放老鼠藥，這也是他們去放的，然後沒有按照標準的放置方式，這也是他們做的，何來誘導之說。\n\n蔣萬安不會處理老鼠\n倒是很會處理提出問題的人\n抹黑林亮君不會讓台北市的老鼠減少啦,19373
3888906276600527957_73183866377,各位假中立仔，現在才5月，你們就在『我雖然不喜歡蔣萬安但是我更討厭沈伯洋』，真的太早了\n\n聽我一句話，有點耐心，好歹等過4個老鼠生育週期再來說好嗎？,5381
3888848785166657969_63139466539,台北有老鼠搞得鳥世界要毀滅\n怪罪蔣萬安治理不當\n\n高雄浮屍、老鼠那麼多怎麼不換市長？\n台南登革熱死了那麼多人\n這種治理能力跟人格特質卻視而不見？,313
3889196209601204814_65144839809,梅雨季在台北灑老鼠藥？那不是滅鼠，那是投毒。\n雨水一沖，藥塊在土裡崩解，劇毒直接滲進地底。\n這東西進了土壤，基本上就是永久傷害。\n官僚最愛這套。\n噴藥看起來有在做事，民眾看得到煙、看得到藥，就覺得安心。\n實際上呢？\n藥效被雨水稀釋後，老鼠毒不死，反而養出抗藥性。\n最慘的是毒素進了水循環，最後回來到你我的餐桌。\n這種「懶政」造成的生態災難，比老鼠更可怕。\n別再迷信化學滅鼠了。\n梅雨季撒藥，純粹是在慢性自殺。,7164
3888834452834551486_63461208593,台北已經有狗吃到被毒死的老鼠送醫了，願狗狗早日康復。,5444
3887247067483009853_63076835322,家裡有五隻貓 都抓不到一隻老鼠,5276
3886812785808655481_63445933526,大家這幾天一直放老鼠的影片出來\n其實我要說的是……\n\n雙連站旁邊\n有一個叫做世紀豆漿的早餐店\n\n大年初一的時候他們放假\n然後我遛狗經過\n\n我遠遠就聽到\n嘰嘰喳喳 的聲音\n走進去看\n\n我發現豆漿店好像蝙蝠洞\n然後那些蝙蝠不用講了 \n94那些老鼠\n\n害我現在都不敢買那家了😢\n本來有拍下來，不過覺得留在手機裡面好像也蠻觸霉頭的，就把它刪掉\n\n另外一個奇蹟的鼠穴\n其實是在建成公園\n\n因為我以前也是常常在建成公園遛狗\n公園靠近停車場那側\n有一隻金屬做的長頸鹿\n長頸鹿的位置是一個小丘\n\n那個丘呀！感覺很像是老鼠的碉堡\n半夜莫名其妙都會有一些老鼠從那邊一些神秘的地方跑出來！\n\n之前有一些人會拿貨跟BB槍去獵殺那些老鼠，但是也有一些遛狗的朋友是那種很愛護動物的，就覺得他們這樣做很殘忍！\n另外就是雙連市場那邊，常常有一些奇怪的婦人，拿了一大堆飼料在餵鴿子，不是明明就講好那是違法的行為嗎？\n因為我就住在這邊，覺得蠻困擾的。\n但總之我就覺得很酷！\n誰幹得掉老鼠我就支持他,523
3888825018117362357_65173912766,滅老鼠用老鼠藥\n滅蟑螂用蟑螂藥\n那滅火是不是要用,1663
3889420372517466797_63447580660,看來不只是台北市，新北市也逐漸在蔓延中…………….\n看著地圖，甚至覺得老鼠蔓延到桃園也不是不可能🤮🤮🤮,369
3885832642771401031_63092161716,沈伯洋：老鼠問題越來越嚴重。投藥滅鼠是模擬天敵的方式，不一定是最好的方式。\n\n你垃圾廚餘的管控方案是什麼？\n\n紐約從2023做到2025，他們有顯著的減少。\n是不是台北可以參考，應該理性去討論。\n\n---\n立刻給想法 vs 章萬安直接上車走人,15281
3889571954194250197_63048647816,沒有鼠患，幹嘛投老鼠藥,576
3888646536054308264_65144839809,台北街頭的大老鼠變多了。\n這不是衛生問題，是火災前兆。\n老鼠為了磨牙，最愛啃天花板裡的電線。\n絕緣層一破，銅線走火。\n下一秒，你家就是火場。\n這正是台北市防衛系統的崩潰點。\n蔣萬安的北市府還在玩官僚主義：環保局管滅鼠，消防局等救火。\n局處不互通，反應永遠慢半拍。\n這就是沈伯洋強調，單位協調防範的重要\n防衛不只是對抗外敵，更是基礎設施的數位防禦。\n如果還停留在「報案、派人、滅火」的石器時代，\n台北遲早被這群老鼠咬垮。\n科技治國不是口號，是生存。\n如果電力負載感測器能連動 AI 預警，\n如果下水道監控能提前反應，\n火災根本不會發生。\n官僚救不了你。\n家裡莫名跳電？趕快拆天花板檢查。\n別讓台北的繁華，最後毀在一隻老鼠手裡。🐀,2022
3888170877393523757_63270067876,台北土生土長三十幾年，從來沒有印象老鼠是這麼多的，去年第一次遇到老鼠入侵屋內，今年直接發現冷氣管線被啃咬，花了不少錢處理，昨日也在家門的路口看到老鼠逛大街，也不怎麼害怕驅趕。\n\n如同網友們所說的，經過幾個世代後，除了數量多到白天隨處可見之外，也開始不懼怕人類，安鼠之亂不知道何時才能平定。,1103
3890088198332739791_74967636536,跟老鼠溝通不了沒關係，那可以跟蔣萬安溝通一下嗎，叫他好好處理鼠患問題，我相信他有5歲以上、有眼睛、數量僅1人,71
3890145549240944192_63285090064,用幼稚園小朋友也能懂的方式來解釋為什麼老鼠藥反而可能會讓老鼠變更多\n\n因為吃完老鼠藥的老鼠不會馬上死掉，這段時間裡牠會變成毒老鼠，如果被老鷹或是蛇蛇抓到吃掉之後，毒老鼠就會害老鷹跟蛇蛇死掉\n\n然後老鷹爸爸媽媽要長到2歲才可以生小老鷹，一年會生出來的小老鷹不到5隻\n蛇爸爸媽媽也要2、3歲才可以生小蛇蛇，一年生出來的小蛇蛇可能也不到20隻\n\n可是老鼠只要出生2、3個月就可以生小老鼠、生完之後老鼠媽媽馬上就可以再懷孕、生一次可以生快20隻小老鼠出來\n老鼠爸爸媽媽加上牠們的小孩如果都沒有都鼠翹翹的話一年保守估計可以生超過800隻小老鼠哦\n\n如果可以生小孩的大老鷹跟大蛇蛇都因為吃到毒老鼠死光光就不會有小老鷹跟小蛇蛇，也不會有人來吃老鼠\n然後剩下的老鼠就會生更多小老鼠出來哦！老鼠派對！\n所以，你聽懂了嗎？,188
3885764923838566851_63271240949,台北市這也不難選，喜歡動漫投撲馬，,2688
3889245212124362642_63155508882,我是動物溝通師\n客戶請我叫台北市的老鼠離開\n但是老鼠的網路排擠我\n\n但我還是收了5000元\n專業可是有價格的,1322
3890049270594790689_73845151403,如果浪浪老鼠們都能安心吃飽\n\n是不是就不用白天跑出來冒險覓食了呢\n\n如果有家，誰願意流浪？,462
3890094185952928591_63536321132,蔣萬安：「民眾不要看到老鼠就拍照傳到網路上，會讓市民誤以為老鼠真的很多。」\n⠀\n他只是被主廚控制了，才會說出這種話。,572
3887881196799036808_63233789609,最新：\n\n針對台北鼠患，蔣萬安強調，目前用的是中央核可的環境用藥\n\n蔣萬安說，每一個選項，包括「干擾老鼠繁殖」（沈伯洋提的）都有討論\n\nOk看來就是兜圈子還扯中央,2937
3887295189044422074_63462384425,台北市老鼠問題，完全要把蔣萬安KO了，導致鼠疫問題現在只能問台北市長沈伯洋，台北鼠長蔣萬安只能謝謝謝謝逃走。\n-\n「市長，很多老鼠耶，怎麼辦？」\n蔣萬安：「謝謝，謝謝。」（搭車逃走）\n-\n「台北很多老鼠耶！」\n沈伯洋：「這個問題是一個系統性的問題⋯（批哩啪啦講出短期、中期、長期規劃，以及可以借鑑哪些國際城市的處理方式）」\n\n🐭🐭🐭🤷🏻‍♀️,2637
3888692319122921263_63069425753,參加台大婦產科醫局同門的聚餐。\n\n一位醫院的醫師跟我說，他剛剛送太太去台北火車站搭高鐵，就在火車站外圍的人行道上看到一隻S老鼠，然後兩隻鳥在老鼠旁邊啄牠的肉。\n\n看來，大家擔心的事情就快就發生了。,5297
3887250237908025304_79501080441,太扯了吧，在延平北路六段那邊的北投紅茶看到一隻老鼠，而且還是活的！,5926
3889235789637364875_68881894345,其實非本科系有點不太理解\n有鼠患\n不就是應該要用老鼠藥趕快撲滅老鼠嗎\n結果有人說老鼠藥會讓其他生物吃到\n結果又造成生態浩劫\n那還有什麼更快的方式可以去除鼠患嗎？,1612
3887503403413101583_71070707390,@chenshuibian88,3878
3889517211078476903_63250466511,認真問\n如果今天在台北路邊看到老鼠藥，我是能夠自主撿起來拿去丟掉的嗎？\n單純是不希望有任何高階獵食者或小貓小狗甚至小孩子有誤食的風險,365
3887982729279767818_74215228831,一定要多幫忙宣傳讓台北市民與老鼠和平共存的和平大使-草包蔣萬安,6419
3889559235864969196_63271009970,住高樓的我\n以為老鼠災情離我很遠\n結果室友今天去松山高中旁的路邊停車位開車發現⋯\n放在車上的喉糖\n全部被米老鼠吃完囉～\n謝謝蔣萬安\n讓想養寵物的我們\n一夜成真,478
3889385024190113000_67175415628,台北的老鼠真的滿聰明的\n知道快要選舉了，馬上出沒到各處\n不知道選舉選完，老鼠還在不在啊\n什麼老鼠藥生態圈都出現了\n難道這樣柏洋老哥票會比較多嗎,879
3889550494029278573_70847032460,不曉得還會不會擴大，總之先整理一些資訊\n看到老鼠屎先不要掃。那不是普通灰塵，可能沾到鼠尿鼠糞；你一掃，髒灰塵就可能飄到空氣裡。先停手，通風、消毒、濕擦，有發燒或尿量變少就醫時要說鼠跡暴露。這篇先存起來。\n\n#漢他病毒 #鼠跡清理 #防鼠三不,8257
3887454299723734689_63448481031,好消息：蔣萬安讓生育率大幅提升！\n壞消息：是老鼠,4475
3887890458131124549_64169906138,你們因為老鼠太多開始買老鼠藥，家裡開始在意門窗緊密度，開始添購老鼠設備。\n這樣不就是在鼓吹老鼠咬你們嗎！\n這樣不就是在挑釁老鼠嗎！\n不要挑釁就好了買什麼老鼠藥！\n \n我不想要戰爭啊啊啊啊。,8764
3889760295950744091_73218126493,我一直以為鼠患是政治在炒作，結果半夜十二點睡到一半聽到我家後陽台老鼠嘰嘰叫！感覺還不止一隻！去你媽的侯友宜！！！！！\n半夜被吱醒努力上蝦皮尋找鐵絲網垃圾桶😢,246
3890178973531848967_63373549584,以前我大舅要捕鼠，捕鼠籠裡面放的是一大塊炸紅糟鰻，我說這不會吃太好嗎\n大舅的邏輯是，到處都有吃的，不放點好的根本沒辦法吸引他們\n所以想抓老鼠要先有想用心招待他們的心才有可能補到,207
3887431308888876535_71971841603,台北市使用的二代老鼠藥（SGAR）到底多危險？\n\n代謝慢：人用藥1天代謝，SGAR卻會長期累積，劑量再小都致命。\n傷毛孩：散步誤食，微微碰撞就可能大出血死亡，飼主防不勝防。\n毀生態：老鼠沒死透，天敵（老鷹、蛇）先被毒死，導致生態失衡、鼠患加劇。\n\n澳洲、加拿大早已禁止或嚴管，台北市不該落後國際。\n\n滅鼠需要的是「科學手段」，而非治標不治本的藥劑。請市府正視這項隱形威脅！\n\n#台北市 #滅鼠政策 #毛小孩安全 #生態保育 #醫療,6407
3890144712166829466_64384151520,文來自張育萌： 王鴻薇有多怕服務處被送老鼠？——藍白要惡意阻擋檢察總長提名，王鴻薇慌到蓋錯，全院唯一蓋成廢票就是王鴻薇。 ① 王鴻薇昨天才喜滋滋，說台北市這麼多老鼠，是因為「民進黨造鼠計畫啟動」——這種鬼話怎麼說得出口？ 被網友發起「北鼠送薇」，要抓老鼠送到王鴻薇服務處後。 今天早上，王鴻薇又縮了，記者一問「有人要抓老鼠送到服務處」，她就匆匆忙忙說「我⋯⋯我去開會」。 ② 重點是，開完黨團會議，王鴻薇看起來也沒有回神。 今天早上，院會要表決檢察總長人事案。 國民黨最重要的任務就是全部投「不同意」，把人事案擋下來。 ③ 這麼簡單的任務，王鴻薇都可以搞砸——最後開票結果，同意 50 票、不同意 61 票，有一張廢票。 投廢票的，就是王鴻薇。 所有人都傻眼，因為對國民黨來說，團進團出講得很明確——王鴻薇急急忙忙解釋說「因為投票作業時不慎」，把自己的選票搞成廢票。 ④ 講得那麼文謅謅幹嘛，不就蓋錯嗎？ 蓋錯就蓋錯啊，陳昭姿投立法院長也蓋錯啊。 ⑤ 只是國民黨最好的朋友，國昌老師有說過哦「如果連這麼簡單的事情都會搞錯，那你顯然不具有足夠的能力在立法院行使一個立法委員的職權。」,24
3889681740504701082_64202099319,以我家的防鼠經驗，來證實PUMA的說法是正確的。\n去年十月，我家的貓貓在廚房四處鑽行，好像在找什麼東西似的；後來我們發現很多地方都有老鼠屎，於是開始查尋，終於發現沙窗被咬破一個洞，確定了被老鼠入侵的事實。\n對策1.先去買黏鼠板，並將破洞沙窗更新。\n對策2.將家中能被鼠咬食的東西全裝箱隔絕。\n過程：\n新換的沙窗還是再被咬破，黏鼠板共捕捉到5鼠，但我家貓貓還是沒放棄，依然續鑽尋。\n對策3.去找專賣金屬網的店家，買了不鏽鋼金屬網ㄧ小卷，回家直接綁在塑膠沙網上，以杜絕鼠輩再咬破的入侵行為。\n最終結果：\n沒有新鼠再入侵，所剩家中的老鼠，因為室內沒東西吃，又跑不出去，最後餓死家中，其後@找出屍體，做最終出清。\n所以斷絕老鼠的食物來源，是滅鼠的有效作為，故要做好垃圾桶及厨餘的管理是很重要，而且是有效的。謹供大家參考！,1851
3890030114101204460_63456225681,驚爆 / 嗆「造鼠計畫」慘了!民眾揚言抓老鼠送服務處 王鴻薇關門:我…我開會\n\n王鴻薇今日一被記者問到此事，就急忙說，「我…我…我去開會」。面對記者追問，會擔心服務處被送老鼠嗎？她則是沒有回應，立即關上會議室的門。\n\n---\n本人響應「送鼠千金」，這週有效，為了證明不是人造鼠，只要送活鼠、生鮮鼠餅等到王鴻薇服務處進行選民服務行為，服務處只要有同仁收取活鼠、生鮮鼠餅等申訴、合照留下證據即可，名額十位！照片請貼在本篇留言處，即可獲得獎金一千元！週四下午民視、晚上鏡電視，皆可當場頒獎並直播，公開表揚活體獵鼠勇者，讓台北市立委能夠理解市民的苦！\n\n昨日開始，藍白網軍刻意製造假消息用過去消息來貼，刻意掩蓋操作媒體，各位朋友，請多關注鼠患問題，提供最新照片、影片持續貼脆，盡量標記時間地點！,1085
3889382810872658523_63474369673,蔣萬安不誠實，台北市政府環保局也說謊，然後他們現在決定要抹黑林亮君。\n\n台北市政府在公園亂扔老鼠藥，蔣萬安表示，這些都是中央核准的環境藥物，笑死，有人說老鼠藥違法嗎？\n\n叫你投藥不是叫你亂扔老鼠藥。\n\n台北市環保局說投放方式都合乎規定，但台北市政府自己的規定寫著：設置毒餌站，避免寵物、小孩誤食。\n\n台北市政府沒有照規定投放老鼠藥，上週中山現形公園白天出現老鼠，環保局就去那邊隨便投放老鼠藥交差了事。\n\n什麼都怪民進黨，蔣萬安你年底要不要乾脆也投給民進黨？,4562
3890122182538390298_64044694928,台北市愛國西路工地的老鼠有夠大隻,260
3888785620659911218_74840118301,🐀台北老鼠變多主因是近期大規模都更驚擾棲地，迫使老鼠難民大遷徙，加上暖冬延長繁殖期與外送廚餘豐富所致。台北市鼠患熱點主要集中在大安區（特別是東區商圈）、中山區、中正區以及傳統市場周邊。\n🐀雖然住高樓層看似安全，但擅長攀爬的屋頂鼠會沿著管道間、電梯井或冷氣孔進入室內，只要有0.6公分的縫隙就能鑽入，因此各樓層皆有風險。低樓層易受下水道溝鼠侵擾，高樓層則常面臨垂直遷徙的鼠患，防治關鍵在於封堵孔洞而非依賴高度。檢查家中落水孔與管線空隙，才能有效杜絕這些身手矯捷的攀岩高手入室。,1510
3889448648341791672_66222408032,因為要滅鼠，\n反而把老鼠的天敵都毒死了，\n真的是天才，才能做得出的！\n.\n重點是，有一堆人投票給這個天才！\n.\n.\n（依糕｜由香港移民台灣六年）\n（我設計了桌遊《反滲透》，推廣反認知戰）\n（在置頂留言！）,1661
3889456857736218108_76136877063,我住大安區，這幾週看到三次老鼠街上跑，你沒看到真的幸運，我看到覺得生氣，溜狗還要擔心狗勾吃到老鼠藥，真的氣死😡,167
3884315851449620388_63141876742,凌晨三點多\n經過豬肉攤有奇怪的東西在布下面竄\n原來是老鼠在開派對…\n\n新鮮直送的豬肉🙄,10475
3890166654088322314_63092161716,林亮君議員在4/9就提醒了廚餘跟投藥可能誤食的問題，章萬安也承認各地反應出現大量老鼠。\n\n章萬安：我們即刻！\n林亮君：有什麼不一樣？\n徐欣瑩弟弟：鼠藥可以可以繼續申請。\n\n早早提出有建設性的建議，結果王鴻薇只會抹黑，污衊議員自導自演？\n\n章萬安哪次不即刻，哪次不是跨部會。\n結果最擅長的還是擺pose拍照。,305
3889915918537254205_68950068415,台北市最近鼠患真的非常嚴重嗎？？？\n我6月中就要來台北旅行了，無比害怕😱\n本人有極其嚴重恐鼠症，見到老鼠會尖叫暈倒,62
3888618500512764150_63459186203,我這裡有一份大家可以幫忙一起通報的台北老鼠地圖，\n在置頂留言歡迎搭取用。,443
3888890647349370406_63094298469,連武漢病毒都擋得住的人，區區老鼠就更不用說了。\n\n可惜臺北市民2022就是不要陳時中。\n\n你每一次投票，都是在形塑你未來的生活。,4649
3887767116409035152_63231390077,為什麼要投老鼠藥挑釁老鼠？\n和平共存不好嗎？\n為什麼不簽和平協議？\n省下來的錢可以換多少營養午餐？,5253
3890109157085370837_63053054148,認真服務的民代都知道：鼠患問題是台北人真實的擔憂，近日市府沒有照標準SOP「有鼠餌盒、才投藥」，更是造成寵物飼主們的焦慮。\n\n我認為，目前最大的問題是：市民無法獲得基本資訊。\n\n民代的責任就是協助政府一起來解決問題，我誠懇呼籲北市府至少先做3件事：\n\n第一、公布鼠患數據：\n資訊是治理的基礎。鼠患監測不能只靠市民自力救濟，北市府應提供官方統計，公布每日變化。讓民眾能掌握情況。\n\n第二、公開投藥位置：\n飼主們現在人心惶惶，擔心毛孩誤食老鼠藥。\n\n北市府應公開投藥位置及用量。\n\n依照《環境用藥管理法》，民間業者須申報施作紀錄，包括時間、地點、面積、用量及許可證字號。\n政府的投藥紀錄理應比民間更完整。\n\n除非市府沒有落實投藥紀錄，否則應儘速公開投藥位置。\n\n第三、有鼠餌盒 才投藥：\n環境用藥不能亂撒，北市府「請」參考「北市環保局」公布的說明：\n(1) 使用鼠餌盒\n(2) 選擇隱蔽處放置,1734
3886708917712090382_62993178265,台北市有毛小孩、會遛狗的朋友要注意喔\n\n捷運雙連站已經發現投放老鼠藥在「公園地上」了\n\n還有家中有小朋友的家長，也要小心注意\n\n這市長的能力就這樣了，台北市民們自求多福,2835
3889622518306800106_63057159937,「南鼠北送」這種低級的地域歧視，也說得出口。\n\n老鼠不可怕\n可怕的是人的心比老鼠還髒。\n\n國民黨，髒的不是嘴，是心。,3586
3888917606221061430_64431112248,蔣萬安，你可以無能，但不可以說謊！ \n\n台北市環保局今日新聞稿宣稱「駁網傳亂投老鼠藥 北市環保局：位置與中央原則一致」，這是公然說謊。 ​\n\n我對照環中央的滅鼠原則，看看蔣萬安市府說了什麼謊： ​\n\n1. 中央要求「定點紀錄」： 蔣萬安，請立即公布「全市施藥點位地圖」！ 讓家長與牽狗散步的市民知道哪裡是雷區。 不敢公布，就是心虛！\n\n2. 中央要求「防誤食警示」： 北市府有做嗎？\n\n3. 中央建議「滅鼠餌站」 ：\n滅鼠餌站是開口僅容老鼠進入的盒子，保護鳥類和貓狗不誤食。 有誰看到過？\n\n蔣萬安還說「不是那些地方的鼠藥就不是環保局投放」，這句話最可恥。 身為主管機關，若有不明人士在公共區域投毒，你不抓人、不巡檢，竟然回一句「不是我投的」就想甩鍋？ ​蔣萬安，別把市民當笨蛋。\n\n再說一次，蔣萬安，你可以無能，但不能說謊,10486
3888302444061342845_63427846243,北市府狂投老鼠藥\n\n藥師公會這時候怎麼不出來擔心抗藥性了,10628
3889932472683835598_63408853878,看起來網軍已經沒在脆上洗移工的事情，所以最後是確定引進嗎？,168
3890117052921357714_64997886285,現在經費都拿去造謠台北老鼠了\n老實說，我不知道老鼠真的多還是假的多，但蠻明顯是某個時間點之後就突然爆多\n呵呵,68
3889929492907558348_71950049909,天啊，整個 Threads 都是老鼠文🐭\n\n說也奇怪，當初那群「百工百業挺罷免」的人，好像體質特別敏感，很容易就遇到老鼠。\n\n正常上班、做生意的人，其實很少在聊政治吧？\n那時卻突然變成「百工百業都在挺」，\n而且現在年輕人普遍對政治偏冷感，真的會那麼整齊一致嗎？\n\n現在台北突然一堆「鼠患」話題，\n有沒有覺得，跟當初那波操作，有點似曾相識？\n\n要怎麼結束？\n多來幾次 32:0，自然就安靜了。\n有些東西，多看幾次就懂了。,279
3889977692867721650_64263408541,我也在附近公園看過老鼠，大剌剌在路上竄，以前都不會如此,63
3889572288344949815_64207406446,下載脆也2年多了，覺得笑點變高了，因為大家實在很幽默。 但是我今天滑到一個留言還是笑了。\n王鴻薇覺得台北市的老鼠都是民進黨派出來的臨鼠演員🤣🤣🤣,6480
3889994017685456104_71840416477,抱歉，\n這鼠患要撐到年底選舉完，\n\n等選舉完畢，\n這些老鼠會在0.0001毫秒之間消失。,140
3889992183390500906_64247996196,好可愛，另外，別說松鼠老鼠差不多\n\n老鼠 每胎約 6～12隻，一年可生 5～10胎，1隻母鼠可以變成100隻\n\n松鼠 每胎約 2～4隻，一年 1～2胎\n1隻母松鼠一年只升幾隻而已.\n\n而且老鼠只要幾週就性成熟，所以指數級爆炸\n松鼠性成熟要10-12個月，繁衍緩慢的多,795
3889480646671242736_67273865617,住在台北的各位\n看到老鼠記得錄影、拍照\n報時間地點，越詳細越好\n能抓捕的更好！\n\n記得抓到的全送去王鴻薇辦公室\n南鼠北送是吧？把地點證據送給王巫婆🙂🖕\n\n王鴻薇服務處\n台北市延壽街145號2樓,1157
3889423459642721267_63851410130,雙北的老鼠越來越多了\n各位有什麼頭緒嗎？,893
3890057468060023665_66830413077,我是住在平行世界的台北嗎 脆上一堆老鼠結果我到現在還沒看到半隻= =,13
3890075636023295077_64283641150,一打開Threads滿滿的都是老鼠文🐭\n其實大家真的不用太驚慌\n年底選舉結束沈伯洋落選之後\n台北市的鼠患就會自動消失了,36
3890047558320554975_76480261830,相信我，選舉完就沒人要吵老鼠了😮‍💨,15
3890039258639960970_63041756525,那買十噸老鼠藥就是圖利廠商嘍？,474
3889596131017951445_76962536327,排名前三髒的城市和前三乾淨的城市\n第一髒 高雄\n第二髒 台南\n第三髒 嘉義\n第一乾淨 台中\n第二乾淨 台北\n第三乾淨 新北\n某黨執政的城市怎麼特別髒呢😏,367
3889670979941125743_63252918022,你是老鼠嗎？,27
3889562305919125549_63069650516,這溫馨的畫面不能只有我看到⋯\n.\n.\n.\n牠靠著媽媽的那一刻\n時間都變得溫柔了,0
3889674133496293390_63045486789,要小心吃到毒老鼠,853
3889335437827848514_63384281815,台北市老鼠的問題要解決，更不要有小朋友、貓貓狗狗跟野生動物誤食老鼠藥。我身為議員職責的監督，就只是這麼簡單！\n\n在台北市回報鼠患，要被扣上「誘導」的帽子；協助民眾處理陳情，要被台北市政府放話抹黑修理，真的很無奈！\n\n雙連有沒有老鼠？\n\n有！4月30日一篇民眾po文大白天看到老鼠，至今已經40萬點閱。我接收市民陳情，馬上回報請市府處理。\n\n市府投藥有沒有裸露？\n \n有！市府投藥後，大量民眾留言恐慌怕小孩和動物誤觸誤食。我發文提醒附近市民注意，並且回報市府民眾對投藥方式的疑慮。\n\n我再講一次，依照台北市政府自己的鼠類防治會議和滅鼠文宣，投藥要須設置「安全毒餌站」以及「避免兒童與寵物誤食」。\n\n這幾個月以來，發現鼠患的，其實大多是都是市民和threads上的網友。蔣市府今天可以放話攻擊我，但請不要忽視這些市民真實的擔心！,6877
3889589342260130598_63076530636,笑死 我這百分之百\n地點就是台北車站\n我還有證人啦\n敢不敢對賭500萬,2826
